{
  "review_version": "technical-copy-review-v1",
  "reviewed_on": "2026-08-26",
  "review_scope": "71 published playable primary domain records",
  "sources": [
    {
      "id": "source.dell.poweredge_service",
      "title": "Dell PowerEdge Installation and Service Manual — installing and removing system components",
      "url": "https://www.dell.com/support/manuals/en-us/poweredge-r6625/r6625_ism/installing-and-removing-system-components",
      "authority": "platform vendor service manual"
    },
    {
      "id": "source.dmtf.ipmi",
      "title": "DMTF IPMI and Redfish event-log specifications",
      "url": "https://www.dmtf.org/standards/ipmi",
      "authority": "platform-management standard"
    },
    {
      "id": "source.fluke.continuity",
      "title": "Fluke continuity testing guidance",
      "url": "https://www.fluke.com/en-us/learn/blog/digital-multimeters/how-to-test-for-continuity",
      "authority": "measurement-tool vendor guidance"
    },
    {
      "id": "source.freedesktop.journalctl",
      "title": "systemd journalctl manual",
      "url": "https://www.freedesktop.org/software/systemd/man/latest/journalctl.html",
      "authority": "upstream command manual"
    },
    {
      "id": "source.kernel.ipmi",
      "title": "Linux kernel IPMI driver documentation",
      "url": "https://docs.kernel.org/driver-api/ipmi.html",
      "authority": "upstream platform documentation"
    },
    {
      "id": "source.kernel.ras",
      "title": "Linux kernel Reliability, Availability and Serviceability documentation",
      "url": "https://docs.kernel.org/admin-guide/RAS/main.html",
      "authority": "upstream platform documentation"
    },
    {
      "id": "source.man.dmesg",
      "title": "dmesg manual",
      "url": "https://man7.org/linux/man-pages/man1/dmesg.1.html",
      "authority": "upstream command manual"
    },
    {
      "id": "source.man.ethtool",
      "title": "ethtool manual",
      "url": "https://man7.org/linux/man-pages/man8/ethtool.8.html",
      "authority": "upstream command manual"
    },
    {
      "id": "source.man.free",
      "title": "free manual",
      "url": "https://man7.org/linux/man-pages/man1/free.1.html",
      "authority": "upstream command manual"
    },
    {
      "id": "source.man.ip_address",
      "title": "ip-address manual",
      "url": "https://man7.org/linux/man-pages/man8/ip-address.8.html",
      "authority": "upstream command manual"
    },
    {
      "id": "source.man.ip_route",
      "title": "ip-route manual",
      "url": "https://man7.org/linux/man-pages/man8/ip-route.8.html",
      "authority": "upstream command manual"
    },
    {
      "id": "source.man.lsblk",
      "title": "lsblk manual",
      "url": "https://man7.org/linux/man-pages/man8/lsblk.8.html",
      "authority": "upstream command manual"
    },
    {
      "id": "source.man.lspci",
      "title": "lspci manual",
      "url": "https://man7.org/linux/man-pages/man8/lspci.8.html",
      "authority": "upstream command manual"
    },
    {
      "id": "source.man.ping",
      "title": "ping manual",
      "url": "https://man7.org/linux/man-pages/man8/ping.8.html",
      "authority": "upstream command manual"
    },
    {
      "id": "source.nvmexpress.specification",
      "title": "NVM Express specifications",
      "url": "https://nvmexpress.org/specifications/",
      "authority": "storage protocol standard"
    },
    {
      "id": "source.rfc2131.dhcp",
      "title": "RFC 2131 — Dynamic Host Configuration Protocol",
      "url": "https://www.rfc-editor.org/rfc/rfc2131.html",
      "authority": "Internet standard"
    },
    {
      "id": "source.smartmontools.smartctl",
      "title": "smartmontools documentation",
      "url": "https://www.smartmontools.org/wiki/TocDoc",
      "authority": "upstream command documentation"
    },
    {
      "id": "source.uefi.boot_manager",
      "title": "UEFI Specification — Boot Manager",
      "url": "https://uefi.org/specs/UEFI/2.11/03_Boot_Manager.html",
      "authority": "firmware standard"
    }
  ],
  "records": [
    {
      "domain_id": "command.ipmi.sel_elist",
      "review_status": "reviewed",
      "source_ids": [
        "source.dmtf.ipmi",
        "source.kernel.ipmi"
      ],
      "acronym_ids": [
        "term.ipmi"
      ],
      "scoped_uncertainty": "Exact thresholds, indicators, slot maps, hot-swap conditions, and service steps remain controlled by approved platform documentation.",
      "technical_copy_sha256": "a0cd999842a3aaffcb661a8aefc9ddaeb3dc85e7518dedf98754886c2490ebfd"
    },
    {
      "domain_id": "command.linux.dhclient",
      "review_status": "reviewed",
      "source_ids": [
        "source.rfc2131.dhcp"
      ],
      "acronym_ids": [
        "term.dhcp",
        "term.ipv4"
      ],
      "scoped_uncertainty": "Exact thresholds, indicators, slot maps, hot-swap conditions, and service steps remain controlled by approved platform documentation.",
      "technical_copy_sha256": "824e969bb555ef38d642ca0be15bc84bd015ccfc5b5f013b58e14bd275d1c4f2"
    },
    {
      "domain_id": "command.linux.dmesg",
      "review_status": "reviewed",
      "source_ids": [
        "source.man.dmesg"
      ],
      "acronym_ids": [],
      "scoped_uncertainty": "Exact thresholds, indicators, slot maps, hot-swap conditions, and service steps remain controlled by approved platform documentation.",
      "technical_copy_sha256": "b6007354b2c8ebfe5fa4d0a0356511f83c9c49a5bd48b778bb84efeeccd4e79f"
    },
    {
      "domain_id": "command.linux.ethtool",
      "review_status": "reviewed",
      "source_ids": [
        "source.man.ethtool"
      ],
      "acronym_ids": [],
      "scoped_uncertainty": "Exact thresholds, indicators, slot maps, hot-swap conditions, and service steps remain controlled by approved platform documentation.",
      "technical_copy_sha256": "de3e5747354622a99a47e41490dc6a3ef14806660b17d13b324ccf2163b66611"
    },
    {
      "domain_id": "command.linux.free_h",
      "review_status": "reviewed",
      "source_ids": [
        "source.man.free"
      ],
      "acronym_ids": [],
      "scoped_uncertainty": "Exact thresholds, indicators, slot maps, hot-swap conditions, and service steps remain controlled by approved platform documentation.",
      "technical_copy_sha256": "762f9a971796601e7d4ff0e00faaf1b98bd6e4be4bc8b3576d5a7a7f0b01ac2e"
    },
    {
      "domain_id": "command.linux.ip_addr",
      "review_status": "reviewed",
      "source_ids": [
        "source.man.ip_address"
      ],
      "acronym_ids": [
        "term.ip"
      ],
      "scoped_uncertainty": "Exact thresholds, indicators, slot maps, hot-swap conditions, and service steps remain controlled by approved platform documentation.",
      "technical_copy_sha256": "4715ce4b35f0de53cd3e61802e3024698878697e600c26bd053eeedafb2a8c5e"
    },
    {
      "domain_id": "command.linux.ip_route",
      "review_status": "reviewed",
      "source_ids": [
        "source.man.ip_route"
      ],
      "acronym_ids": [],
      "scoped_uncertainty": "Exact thresholds, indicators, slot maps, hot-swap conditions, and service steps remain controlled by approved platform documentation.",
      "technical_copy_sha256": "e4368345086e60d88447a9051225122f2738bd12d177b33bc55a4ebf231d7de4"
    },
    {
      "domain_id": "command.linux.journalctl",
      "review_status": "reviewed",
      "source_ids": [
        "source.freedesktop.journalctl"
      ],
      "acronym_ids": [],
      "scoped_uncertainty": "Exact thresholds, indicators, slot maps, hot-swap conditions, and service steps remain controlled by approved platform documentation.",
      "technical_copy_sha256": "c6eaa20386f8bb6f1ca7d083807217e324ef86f1d40499e2f51fda8abc902482"
    },
    {
      "domain_id": "command.linux.lsblk",
      "review_status": "reviewed",
      "source_ids": [
        "source.man.lsblk"
      ],
      "acronym_ids": [],
      "scoped_uncertainty": "Exact thresholds, indicators, slot maps, hot-swap conditions, and service steps remain controlled by approved platform documentation.",
      "technical_copy_sha256": "44ce7a03ff3126e0f28235e75a6b817c571599e3f2bc38d6b71f5239887667dc"
    },
    {
      "domain_id": "command.linux.lspci",
      "review_status": "reviewed",
      "source_ids": [
        "source.man.lspci"
      ],
      "acronym_ids": [
        "term.pci",
        "term.pcie"
      ],
      "scoped_uncertainty": "Exact thresholds, indicators, slot maps, hot-swap conditions, and service steps remain controlled by approved platform documentation.",
      "technical_copy_sha256": "0c2253bb96f0552d37d9971e2688b2e376264433ad477e244cc0feaf8eaba74e"
    },
    {
      "domain_id": "command.linux.nvme_smart_log",
      "review_status": "reviewed",
      "source_ids": [
        "source.nvmexpress.specification"
      ],
      "acronym_ids": [
        "term.nvme",
        "term.smart"
      ],
      "scoped_uncertainty": "Exact thresholds, indicators, slot maps, hot-swap conditions, and service steps remain controlled by approved platform documentation.",
      "technical_copy_sha256": "a8d0051bcfc94f180a30b3d3845b5943487d5aaab8996b271f796595f09c747d"
    },
    {
      "domain_id": "command.linux.smartctl",
      "review_status": "reviewed",
      "source_ids": [
        "source.smartmontools.smartctl"
      ],
      "acronym_ids": [
        "term.smart"
      ],
      "scoped_uncertainty": "Exact thresholds, indicators, slot maps, hot-swap conditions, and service steps remain controlled by approved platform documentation.",
      "technical_copy_sha256": "bb4586f01a7abb406be2cc0a7a8d0b0288be2a0c4da2b6c7a51452aae6371e39"
    },
    {
      "domain_id": "command.network.ping",
      "review_status": "reviewed",
      "source_ids": [
        "source.man.ping"
      ],
      "acronym_ids": [
        "term.icmp",
        "term.ip"
      ],